{"schema_version":1,"workspace_id":"ws_alpha","registry_revision":"rev1","projects":[{"project_id":"proj"}],"repositories":[{"project_id":"proj","repo_id":"app"},{"project_id":"proj","repo_id":"docs"}],"relationships":[{"relationship_id":"rel_docs","relationship_type":"documentation_companion","source":{"project_id":"proj","repo_id":"app"},"target":{"project_id":"proj","repo_id":"docs"},"registry_revision":"rev1","lifecycle":"active","revision":"r1"}]}
